{
  "id": "PROD-4487",
  "is_incident": true,
  "severity": "P1",
  "root_cause": "Feature flag 'guest-checkout' enabled for cohort B (incl. Acme Corp) at 07:12 put Acme on the guest-checkout path hitting the PaymentService.java:142 NPE.",
  "evidence": [
    "deploys/recent.json: tenant-config-service v3.2.1 deployed_at 2026-05-20T07:12:08Z, summary 'Enable feature flag guest-checkout for cohort B (Acme Corp included)'",
    "issues/PROD-4487.json: Acme-only, started 07:25 UTC",
    "deploys/recent.json: frontend v12.4.1 at 06:50 changed only src/pages/pricing.tsx \u2014 ruled out"
  ],
  "runbook": "runbooks/payment-service-degraded.md",
  "related_deploy": {
    "service": "tenant-config-service",
    "version": "v3.2.1",
    "rollback_to": "v3.2.0"
  },
  "linked_issues": [
    "PROD-4521"
  ],
  "recommended_action": "Disable the guest-checkout flag for cohort B or roll back tenant-config-service to v3.2.0. Give the CSM a status line before the CTO call.",
  "page": "CSM + on-call",
  "confidence": "high",
  "needs_human": false
}
